{
  "requestId": "edit_mut_req_01HT010Q0K2N4B6V8M1S3D5F7H",
  "status": "applied",
  "document": {
    "documentId": "edit_01HSZ4W0AQV3M7A0YQY7EJQ2AB",
    "schemaVersion": "rawcraft.adjustment-stack/v1",
    "assetId": "asset_01HSZ4VKGK9N9VQMVTEWZ0P8R4",
    "basedOnAssetRevisionId": "asset_rev_0001",
    "currentRevisionId": "rev_000125",
    "latestEventSequence": 125,
    "rendererVersion": "process-pipeline/1.0.0",
    "metadata": {
      "renderLineage": {
        "previewSource": {
          "tier": "edit_preview",
          "sourceAssetRevisionId": "asset_rev_0001",
          "sourceRevisionId": "rev_000124",
          "generatedAt": "2026-04-05T09:51:30Z"
        },
        "cacheLineage": {
          "previewCacheVersion": "preview-cache/v3",
          "renderCacheVersion": "render-cache/v5",
          "invalidatesAfterSequence": 124
        },
        "inputProfiles": {
          "cameraProfileId": "canon/eos-r6m2/adobe-standard",
          "inputIccProfileId": "icc/adobe-rgb-1998",
          "workingColorSpaceId": "color/linear-prophoto-rgb"
        },
        "sidecarLink": {
          "xmpAssetId": "sidecar_01HSZ4Z5W6VMPA9Y44Q6ZB7M1C",
          "xmpAssetRevisionId": "sidecar_rev_0003",
          "xmpDigest": "sha256:2e9b2c6b"
        }
      }
    },
    "stack": {
      "entries": [
        {
          "id": "adj_exposure_01",
          "tool": "exposure",
          "stage": "tone",
          "enabled": true,
          "scope": {
            "target": "global"
          },
          "params": {
            "ev": 0.5
          },
          "paramSchemaVersion": 1,
          "provenance": {
            "actorType": "human",
            "actorId": "user_donghee",
            "sourceKind": "editor",
            "summary": "Exposure slider adjustment"
          },
          "createdAt": "2026-04-05T09:50:00Z",
          "updatedAt": "2026-04-05T10:05:00Z"
        },
        {
          "id": "adj_subject_mask_01",
          "tool": "subject_light",
          "stage": "local",
          "enabled": true,
          "scope": {
            "target": "mask",
            "maskId": "mask_subject_01"
          },
          "params": {
            "exposure": 0.2,
            "shadows": 18
          },
          "paramSchemaVersion": 1,
          "blend": {
            "mode": "normal",
            "opacity": 0.85
          },
          "provenance": {
            "actorType": "ai",
            "actorId": "copilot",
            "sourceKind": "ai_run",
            "runId": "run_01HSZ57CN5D7AER3Y2GG5Z5B6J",
            "model": "gpt-5.4",
            "promptDigest": "sha256:5a3a2d4f",
            "summary": "Accepted AI relight suggestion"
          },
          "createdAt": "2026-04-05T09:51:30Z",
          "updatedAt": "2026-04-05T09:51:30Z"
        }
      ]
    }
  },
  "event": {
    "eventId": "evt_01HT010W3A5C7E9G1J2L4N6P8R",
    "schemaVersion": "rawcraft.history-event/v1",
    "documentId": "edit_01HSZ4W0AQV3M7A0YQY7EJQ2AB",
    "sequence": 125,
    "parentRevisionId": "rev_000124",
    "resultRevisionId": "rev_000125",
    "timestamp": "2026-04-05T10:05:00Z",
    "actor": {
      "id": "user_donghee",
      "type": "human",
      "displayName": "Donghee"
    },
    "source": {
      "kind": "editor",
      "clientId": "desktop-app",
      "sessionId": "session_01HSZ5A0WMP9W0DF1FET6A8ZQB"
    },
    "intent": {
      "kind": "manual_adjustment",
      "summary": "Raised exposure slightly while fine-tuning skin tones",
      "correlationId": "ui-slider-exposure"
    },
    "ops": [
      {
        "type": "adjustment.update_params",
        "adjustmentId": "adj_exposure_01",
        "params": {
          "ev": 0.5
        },
        "previousParams": {
          "ev": 0.35
        }
      }
    ],
    "integrity": {
      "stackHashBefore": "sha256:b3d91d7a",
      "stackHashAfter": "sha256:d17a6f20"
    }
  },
  "warnings": []
}
